<?xml version="1.0" encoding="UTF-8"?>
<bank-deposits xmlns:xsi="http://www.w3.org/2001/XMLSchema-instance"
               xmlns="http://www.example.com/bankDeposits"
               xsi:schemaLocation="http://www.example.com/bankDeposits  bankDeposits.xsd">

    <individual-deposit id="GE0M354123" country="China" currency = "EURO">
        <bank-name>JPMorganChase</bank-name>
        <amount>10000</amount>
        <percent>5</percent>
        <depositor-name>Adolf</depositor-name>
        <depositor-surname>Hittler</depositor-surname>
        <passport-number>kh1111</passport-number>
    </individual-deposit>

    <individual-deposit id="GE0M34123" currency = "EURO">
        <bank-name>HSBC</bank-name>
        <amount>1000</amount>
        <percent>10</percent>
        <depositor-name>Eric</depositor-name>
        <depositor-surname>Browser</depositor-surname>
        <passport-number>mp2222</passport-number>
    </individual-deposit>

    <fixed-termed-deposit id="a333vvB3" country="USA" currency = "DOLLAR">
        <bank-name>BankOfAmerica</bank-name>
        <amount>50000</amount>
        <percent>1</percent>
        <depositor-name>Oscar</depositor-name>
        <depositor-surname>Coul</depositor-surname>
        <passport-number>mp3333</passport-number>
        <number-of-years>5</number-of-years>
    </fixed-termed-deposit>

    <fixed-termed-deposit id="n4444444" currency = "YUAN">
        <bank-name>	BankofChina</bank-name>
        <amount>50000</amount>
        <percent>2</percent>
        <depositor-name>Julia</depositor-name>
        <depositor-surname>Shelf</depositor-surname>
        <passport-number>mp44444</passport-number>
        <number-of-years>3</number-of-years>
    </fixed-termed-deposit>

    <legal-entity-deposit id="HJ555555" currency = "DOLLAR">
        <bank-name>BankofSpain</bank-name>
        <amount>9000</amount>
        <percent>3</percent>
        <company-name>Bubbles</company-name>
        <number-of-founders>2</number-of-founders>
    </legal-entity-deposit>

    <legal-entity-deposit id="lF666666" country="Canada" currency = "DOLLAR">
        <bank-name>RoyalBankofCanada</bank-name>
        <amount>2500</amount>
        <percent>4</percent>
        <company-name>Umbrella</company-name>
        <number-of-founders>500</number-of-founders>
    </legal-entity-deposit>

</bank-deposits>